{
  "version": 1,
  "settings": {},
  "connections": [],
  "scopes": [
    {
      "id": "maintenance",
      "name": "maintenance",
      "authorization": {
        "connections": [],
        "operations": [
          "emit",
          "read_context",
          "declare_outcome"
        ],
        "read_scopes": []
      },
      "bindings": [
        {
          "name": "run",
          "executor": "shell",
          "requires": {
            "toolbelt": "cli"
          },
          "operations": [
            "emit",
            "read_context",
            "declare_outcome"
          ],
          "secret_names": [],
          "config": {
            "command": "printf hello"
          }
        }
      ],
      "routes": [
        {
          "name": "incoming",
          "handler": "manual",
          "binding": "run",
          "active_policy": "queue",
          "config": {}
        }
      ],
      "extensions": [
        {
          "name": "nightly",
          "type": "schedule",
          "secret_names": [],
          "config": {
            "every_seconds": 86400,
            "event_type": "fixture.schedule.v1",
            "binding": "run"
          }
        }
      ]
    }
  ]
}
